{
  "schema": "steam-hypergraph.observation-publication/v1",
  "publication_id": "pub_demo",
  "permit_id": "permit_demo",
  "artifact_digest": "aaaaaaaaaaaaaaaaaaaaaaaaaaaaaaaaaaaaaaaaaaaaaaaaaaaaaaaaaaaaaaaa",
  "subject": "steam:76561198000000000",
  "scrape_class": "public",
  "relation_assertions": [
    {
      "relation_type": "steam.friendship",
      "participants": [
        {
          "node": "steam:76561198000000000",
          "role": "friend",
          "ordinal": 0
        },
        {
          "node": "steam:76561198000000001",
          "role": "friend",
          "ordinal": 1
        }
      ]
    }
  ],
  "submitted_at": "2026-08-18T16:00:00Z"
}
